{
  "id": "hundi",
  "title": "হুন্ডি কেন বিপজ্জনক",
  "summary": "হুন্ডিতে রেট একটু বেশি মনে হলেও ঝুঁকি অনেক বেশি। বৈধ পথে পাঠালে কী কী সুবিধা।",
  "documents": {
    "value": [],
    "source": "https://www.bb.org.bd/",
    "checked": "2000-01-01",
    "note": "unverified — seeded from Figma/test fixture"
  },
  "steps": {
    "value": [],
    "source": "https://www.bb.org.bd/",
    "checked": "2000-01-01",
    "note": "unverified — seeded from Figma/test fixture"
  },
  "fees": {
    "value": [],
    "unit": "BDT",
    "source": "https://www.bb.org.bd/",
    "checked": "2000-01-01",
    "note": "unverified — seeded from Figma/test fixture"
  },
  "faq": [],
  "sources": [
    {
      "label": "বাংলাদেশ ব্যাংক",
      "url": "https://www.bb.org.bd/"
    }
  ]
}
