{
  "id": "e-passport",
  "title": "ই-পাসপোর্ট: নতুন ও রিনিউ",
  "summary": "অনলাইন আবেদন থেকে পাসপোর্ট হাতে পাওয়া পর্যন্ত পুরো ধাপ।",
  "documents": {
    "value": [],
    "source": "https://www.epassport.gov.bd/",
    "checked": "2000-01-01",
    "note": "unverified — seeded from Figma/test fixture"
  },
  "steps": {
    "value": [],
    "source": "https://www.epassport.gov.bd/",
    "checked": "2000-01-01",
    "note": "unverified — seeded from Figma/test fixture"
  },
  "fees": {
    "value": [],
    "unit": "BDT",
    "source": "https://www.epassport.gov.bd/",
    "checked": "2000-01-01",
    "note": "unverified — seeded from Figma/test fixture"
  },
  "faq": [],
  "sources": [
    {
      "label": "ই-পাসপোর্ট পোর্টাল",
      "url": "https://www.epassport.gov.bd/"
    }
  ]
}
