{
  "id": "board-marksheet",
  "title": "বোর্ডের নম্বরপত্র তোলা ও সংশোধন",
  "summary": "শিক্ষা বোর্ড থেকে নম্বরপত্র তোলা আর ভুল থাকলে সংশোধন করার ধাপ।",
  "documents": {
    "value": [],
    "source": "https://www.educationboard.gov.bd/",
    "checked": "2000-01-01",
    "note": "unverified — seeded from Figma/test fixture"
  },
  "steps": {
    "value": [],
    "source": "https://www.educationboard.gov.bd/",
    "checked": "2000-01-01",
    "note": "unverified — seeded from Figma/test fixture"
  },
  "fees": {
    "value": [],
    "unit": "BDT",
    "source": "https://www.educationboard.gov.bd/",
    "checked": "2000-01-01",
    "note": "unverified — seeded from Figma/test fixture"
  },
  "faq": [],
  "sources": [
    {
      "label": "শিক্ষা বোর্ড",
      "url": "https://www.educationboard.gov.bd/"
    }
  ]
}
