{
  "id": "warish-certificate",
  "title": "ওয়ারিশ সনদ",
  "summary": "ওয়ারিশ সনদ কোথায় আর কিভাবে তুলতে হয়, কী কাগজ লাগে।",
  "documents": {
    "value": [],
    "source": "https://lgd.gov.bd/",
    "checked": "2000-01-01",
    "note": "unverified — seeded from Figma/test fixture"
  },
  "steps": {
    "value": [],
    "source": "https://lgd.gov.bd/",
    "checked": "2000-01-01",
    "note": "unverified — seeded from Figma/test fixture"
  },
  "fees": {
    "value": [],
    "unit": "BDT",
    "source": "https://lgd.gov.bd/",
    "checked": "2000-01-01",
    "note": "unverified — seeded from Figma/test fixture"
  },
  "faq": [],
  "sources": [
    {
      "label": "স্থানীয় সরকার বিভাগ",
      "url": "https://lgd.gov.bd/"
    }
  ]
}
